4689,['Cabinet of Commissioner Stella Kyriakides'],[],"('Panayiotis Pourgourides', 'Karolina Herbout-Borczak')","('Cabinet member', 'Cabinet member')",12/09/20,"('842315534764-63',)",Cruelty Free Europe,Virtual meeting,introductory exchange of views on animal testing replacements and the pharmaceutical strategy
4690,['Cabinet of Commissioner Virginijus Sinkevičius'],[],"('Camilla Bursi',)","('Cabinet member',)",12/09/20,"('842315534764-63',)",Cruelty Free Europe,Virtual meeting,to discuss the recently published chemicals strategy for sustainability and animals testing
4819,['Cabinet of Commissioner Jutta Urpilainen'],[],"('Renaud Savignat',)","('Cabinet member',)",12/17/20,"('968421535984-01',)",World Leadership Alliance-Club de Madrid,Teleconference,covid19 response
4820,['Cabinet of Commissioner Jutta Urpilainen'],[],"('Diana Montero Melis',)","('Cabinet member',)",12/17/20,"('968421535984-01',)",World Leadership Alliance-Club de Madrid,Videoconference,multilateralism
4854,['Cabinet of President Ursula von der Leyen'],[],"('Kurt Vandenberghe',)","('Cabinet member',)",01/08/21,"('371567915480-41',)",Bill & Melinda Gates Foundation,Brussels (Teams),covid-19
4855,[],['Directorate-General for International Partnerships'],"('Koen Doens',)","('Director-General',)",01/08/21,"('371567915480-41',)",Bill & Melinda Gates Foundation,VTC,introductory meeting with newly appointed president of global policy and advocacy. collaboration and priorities.
4899,['Cabinet of Executive Vice-President Valdis Dombrovskis'],[],"('Andrea Beltramello',)","('Cabinet member',)",01/12/21,"('892857311821-20',)",Compagnie de SAINT-GOBAIN,video-conference,eu taxonomy for sustainable activities
4900,['Cabinet of Commissioner Mairead Mcguinness'],[],"('Katherine Power',)","('Cabinet member',)",01/12/21,"('892857311821-20',)",Compagnie de SAINT-GOBAIN,Virtual,taxonomy and climate objectives in the building sector
4920,['Cabinet of Executive Vice-President Valdis Dombrovskis'],[],"('Valdis Dombrovskis ',)","('Executive Vice-President',)",01/13/21,"('64879142323-90',)",European Chemical Industry Council,Video conferencing,"chemicals strategy for sustainability (css) and the need for enforcement, wto aspects of css measures and expected reactions from across the world,
cbam,
brexit implications for the chemical sector"
4921,['Cabinet of Executive Vice-President Margrethe Vestager'],[],"('Margrethe Vestager',)","('Executive Vice-President',)",01/13/21,"('64879142323-90',)",European Chemical Industry Council,Brussels (virtual),competition and the green deal
4941,['Cabinet of Commissioner Janusz Wojciechowski'],[],"('Roberto Berutti', 'Jorge Pinto Antunes')","('Cabinet member', 'Cabinet member')",01/15/21,"('1414929419-24',)",WWF European Policy Programme,Webex,eu taxonomy
4942,[],"['Internal Market, Industry, Entrepreneurship and SMEs']","('Kerstin Jorna',)","('Director-General',)",01/15/21,"('1414929419-24',)",WWF European Policy Programme,Brussels,"general discussion about the new industrial strategy, the eu ets revision and clean hydrogen alliance"
4974,['Cabinet of Commissioner Thierry Breton'],[],"('Eszter Batta', 'Joan Canton')","('Cabinet member', 'Cabinet member')",01/18/21,"('458140332839-09',)","Gates Ventures, LLC",Videoconference,"innovation, green deal, financing"
4975,['Cabinet of Commissioner Kadri Simson'],[],"('Kitti Nyitrai', 'Laure Chapuis-Kombos', 'Stefano Grassi', 'Helena Hinto')","('Cabinet member', 'Cabinet member', 'Cabinet member', 'Cabinet member')",01/18/21,"('458140332839-09',)","Gates Ventures, LLC",Videoconference,private sector investment in energy and climate innovation
5017,['Cabinet of Commissioner Mairead Mcguinness'],[],"('Katherine Power',)","('Cabinet member',)",01/20/21,"('64869491516-70',)",Stichting European Climate Foundation,Virtual,draft delegated act of taxonomy
5018,"['Cabinet of Executive Vice-President Frans Timmermans', 'Cabinet of Executive Vice-President Valdis Dombrovskis']",[],"('Antoine Colombani', 'Andrea Beltramello')","('Cabinet member', 'Cabinet member')",01/20/21,"('64869491516-70',)",Stichting European Climate Foundation,video-call,eu taxonomy for sustainable activities
5022,['Cabinet of Vice-President Věra Jourová'],[],"('Renate Nikolay',)","('Cabinet member',)",01/20/21,"('90142503473-81',)",Vodafone Belgium SA,Videoconference,data protection
5023,['Cabinet of Commissioner Didier Reynders'],[],"('Geneviève Tuts', 'Lucrezia Busa')","('Cabinet member', 'Cabinet member')",01/20/21,"('90142503473-81',)",Vodafone Belgium SA,Video conference,"schrems ii, the eu data strategy and digital sovereignty"
5025,['Cabinet of Commissioner Mairead Mcguinness'],[],"('Tommy De Temmerman',)","('Cabinet member',)",01/21/21,"('0764199368-97',)",Bundesverband deutscher Banken e.V.,Virtual call,basel iii
5026,['Cabinet of Commissioner Mairead Mcguinness'],[],"('Agnieszka Drzewoska', 'Florian Denis')","('Cabinet member', 'Cabinet member')",01/21/21,"('0764199368-97',)",Bundesverband deutscher Banken e.V.,virtual meeting,"retail finance, digital finance, cmu"
5033,['Cabinet of Commissioner Thierry Breton'],[],"('Eszter Batta', 'Thierry Breton')","('Cabinet member', 'Commissioner')",01/21/21,"('350977437809-66',)",Costa Cruises,Videoconference,impact of the covid crisis on tourism and cruise ship industry
5034,['Cabinet of Commissioner Adina Vălean'],[],"('Rachel Smit', 'Adina-Ioana Vălean')","('Cabinet member', 'Commissioner')",01/21/21,"('350977437809-66',)",Costa Cruises,Conference call,meeting to discuss developments of the cruise sector.
5097,['Cabinet of Vice-President Dubravka Šuica'],[],"('Dubravka Šuica',)","('Vice-President',)",01/26/21,"('36529354479-57',)",Groupement Européen des Sociétés d'Auteurs et Compositeurs,Online,conference on the future of europe
5098,['Cabinet of Executive Vice-President Valdis Dombrovskis'],[],"('Valdis Dombrovskis ',)","('Executive Vice-President',)",01/26/21,"('36529354479-57',)",Groupement Européen des Sociétés d'Auteurs et Compositeurs,video-conference ,"discussion on effects of covid19 crisis to the cultural and creative sectors, eu's support for culture and creative sectors, including recovery and resilience facility"
5099,['Cabinet of Commissioner Thierry Breton'],[],"('Agnieszka Skonieczna', 'Thierry Breton')","('Cabinet member', 'Commissioner')",01/26/21,"('36529354479-57',)",Groupement Européen des Sociétés d'Auteurs et Compositeurs,Videoconference,exchange on covid-19 impact on culture and creative sector
5100,['Cabinet of Commissioner Nicolas Schmit'],[],"('Anouk Faber', 'Antoine Kasel', 'Nicolas Schmit')","('Cabinet member', 'Cabinet member', 'Commissioner')",01/26/21,"('36529354479-57',)",Groupement Européen des Sociétés d'Auteurs et Compositeurs,Videoconference ,meeting on the impact of covid-19 on the creative and cultural sector.
5101,['Cabinet of Vice-President Margaritis Schinas'],[],"('Margaritis Schinas', 'Catherine Sustek')","('Vice-President', 'Cabinet member')",01/26/21,"('36529354479-57',)",Groupement Européen des Sociétés d'Auteurs et Compositeurs,virtual meeting,rebuilding europe: the cultural and creative economy before and after covid-19
5102,['Cabinet of Commissioner Mariya Gabriel'],[],"('Mariya Gabriel',)","('Commissioner',)",01/26/21,"('36529354479-57',)",Groupement Européen des Sociétés d'Auteurs et Compositeurs,Videoconferencing ,the impact of the crisis on the cultural sector
5123,['Cabinet of Commissioner Mairead Mcguinness'],[],"('Mairead McGuinness',)","('Commissioner',)",01/27/21,"('049060636194-17',)",World Economic Forum,Video Conferencing,financing the 'net zero' transactions
5124,['Cabinet of Commissioner Virginijus Sinkevičius'],[],"('Virginijus Sinkevičius', 'Eglantine Cujo')","('Commissioner', 'Cabinet member')",01/27/21,"('049060636194-17',)",World Economic Forum,Virtual,"panel discussion on building a net-zero, nature-positive economy and how the private sector can support the european green deal ambitious targets"
5159,['Cabinet of Commissioner Nicolas Schmit'],[],"('Anouk Faber', 'Ana Carla  Pereira', 'Antoine Kasel', 'Jose Antonio Vieira Da Silva')","('Cabinet member', 'Cabinet member', 'Cabinet member', 'Cabinet member')",01/28/21,"('06698681039-26',)",EUROPEAN TRADE UNION CONFEDERATION,online,european pillar of social rights and porto social summit
5160,['Cabinet of Executive Vice-President Frans Timmermans'],[],"('Frans Timmermans',)","('Executive Vice-President',)",01/28/21,"('06698681039-26',)",EUROPEAN TRADE UNION CONFEDERATION,Brussels - videoconference,"just transition, social aspects of recovery"
5196,"['Cabinet of Executive Vice-President Frans Timmermans', 'Cabinet of Commissioner Mairead Mcguinness']",[],"('Antoine Colombani', 'Katherine Power')","('Cabinet member', 'Cabinet member')",01/29/21,"('806327336072-56',)",The Club of Rome,video-call,eu taxonomy for sustainable activities
5197,['Cabinet of Executive Vice-President Valdis Dombrovskis'],[],"('Andrea Beltramello',)","('Cabinet member',)",01/29/21,"('806327336072-56',)",The Club of Rome,video conferense,sustainable finance - eu taxonomy
5249,['Cabinet of Executive Vice-President Frans Timmermans'],[],"('Daniel Mes',)","('Cabinet member',)",02/03/21,"('1811573195-25',)",Inland Navigation Europe,video call,inland waterways in the eu green deal
5250,['Cabinet of Commissioner Adina Vălean'],[],"('Rachel Smit',)","('Cabinet member',)",02/03/21,"('1811573195-25',)",Inland Navigation Europe,Conference call,meeting on naiades
5258,[],['Mobility and Transport'],"('Henrik Hololei',)","('Director-General',)",02/03/21,"('4016736872-59',)",General Electric Company,virtual,"covid-19, saf"
5259,['Cabinet of Commissioner Adina Vălean'],[],"('Gaëlle Michelier',)","('Cabinet member',)",02/03/21,"('4016736872-59',)",General Electric Company,Conference call,meeting to prepare the future meeting between our commissioner and ge ceo.
5293,['Cabinet of Executive Vice-President Valdis Dombrovskis'],[],"('Cristina Rueda Catry', 'Mirzha De Manuel', 'Andrea Beltramello')","('Cabinet member', 'Cabinet member', 'Cabinet member')",02/05/21,"('06698681039-26',)",EUROPEAN TRADE UNION CONFEDERATION,virtual meeting,"discussion on trade negotiations and the trade policy review, with a focus on trade and sustainable development."
5294,['Cabinet of Commissioner Nicolas Schmit'],[],"('Nicolas Schmit', 'Anouk Faber', 'Ana Carla  Pereira')","('Commissioner', 'Cabinet member', 'Cabinet member')",02/05/21,"('06698681039-26',)",EUROPEAN TRADE UNION CONFEDERATION,Videoconference,meeting on the proposed directive on adequate minimum wages.
5295,['Cabinet of Executive Vice-President Valdis Dombrovskis'],[],"('Mirzha De Manuel',)","('Cabinet member',)",02/05/21,"('06698681039-26',)",EUROPEAN TRADE UNION CONFEDERATION,"Brussels, online","purpose of the meeting was to discuss the new cabinet team and the recent and forthcoming actions on employment and social files, including social dialogue."
5307,['Cabinet of Commissioner Mairead Mcguinness'],[],"('Katherine Power',)","('Cabinet member',)",02/05/21,"('42433582-82',)",Forum Atomique Européen,Virtual,draft delegated act taxonomy regulation
5308,['Cabinet of Commissioner Mairead Mcguinness'],[],"('Katherine Power',)","('Cabinet member',)",02/05/21,"('42433582-82',)",Forum Atomique Européen,Virtual,esg reporting and a single platform
5323,['Cabinet of Commissioner Mairead Mcguinness'],[],"('Katherine Power',)","('Cabinet member',)",02/08/21,"('6256831207-27',)",ENEL SpA,Virtual,sustainability linked bonds
5324,['Cabinet of Executive Vice-President Valdis Dombrovskis'],[],"('Andrea Beltramello',)","('Cabinet member',)",02/08/21,"('6256831207-27',)",ENEL SpA,Video conference,sustainable finance
5336,['Cabinet of Executive Vice-President Frans Timmermans'],[],"('Daniel Mes',)","('Cabinet member',)",02/09/21,"('3305029916-47',)",Scania AB (publ),video call,electric trucks
5337,['Cabinet of Executive Vice-President Frans Timmermans'],[],"('Daniel Mes',)","('Cabinet member',)",02/09/21,"('3305029916-47',)",Scania AB (publ),video call,transition to zero emission mobility
5411,['Cabinet of President Ursula von der Leyen'],[],"('Valeria Miceli',)","('Cabinet member',)",02/12/21,"('6256831207-27',)",ENEL SpA,Brussels,africa europe green energy initiative. ms montero joined the meeting organized by cab vdl - valeria miceli
5412,['Cabinet of Commissioner Jutta Urpilainen'],[],"('Diana Montero Melis',)","('Cabinet member',)",02/12/21,"('6256831207-27',)",ENEL SpA,videoconference,africa europe green energy initiative. ms montero joined the meeting organized by cab vdl - valeria miceli. ms montero joined the meeting organized by cab vdl - valeria miceli
5426,['Cabinet of Commissioner Kadri Simson'],[],"('Kitti Nyitrai', 'Kadri Simson')","('Cabinet member', 'Commissioner')",02/15/21,"('64879142323-90',)",European Chemical Industry Council,Online,decarbonisation of the chemical industry through electrification and clean decarbonisation of the chemical industry through electrification and clean hydrogen..
5427,['Cabinet of Commissioner Kadri Simson'],[],"('Kitti Nyitrai',)","('Cabinet member',)",02/15/21,"('64879142323-90',)",European Chemical Industry Council,Brussels,decarbonisation of the chemical industry through electrification and clean hydrogen.
5496,['Cabinet of Executive Vice-President Margrethe Vestager'],[],"('Werner Stengg', 'Kim Jorgensen')","('Cabinet member', 'Cabinet member')",02/19/21,"('061601915428-87',)",ITI - The Information Technology Industry Council,Brussels (online),"dsa, dma, ai"
5497,['Cabinet of President Ursula von der Leyen'],[],"('Anthony Whelan',)","('Cabinet member',)",02/19/21,"('061601915428-87',)",ITI - The Information Technology Industry Council,Brussels (WEBEX),"eu policy files relevant to the technology industry - transatlantic trade and data flows, digital decade, digital and green, artificial intelligence, digital services act, digital markets act"
5545,['Cabinet of Commissioner Mairead Mcguinness'],[],"('Mairead McGuinness',)","('Commissioner',)",02/23/21,"('77823123416-69',)",European Parliamentary Financial Services Forum,Video Conferencing,vision for the eu.
5546,['Cabinet of Commissioner Mairead Mcguinness'],[],"('Mairead McGuinness', 'Deirdre O’Hea')","('Commissioner', 'Cabinet member')",02/23/21,"('77823123416-69',)",European Parliamentary Financial Services Forum,Video Conferencing,"webinar speaking engagement at their winter conference - recovery, cmu, sustainable finance, digital finance"
5550,['Cabinet of Commissioner Thierry Breton'],[],"('Joan Canton',)","('Cabinet member',)",02/24/21,"('10257354120-19',)",Neste Oyj,Videoconference,"renewable energy, circular economy"
5551,[],['Mobility and Transport'],"('Henrik Hololei',)","('Director-General',)",02/24/21,"('10257354120-19',)",Neste Oyj,virtual,saf
5574,['Cabinet of Commissioner Jutta Urpilainen'],[],"('Jutta Urpilainen',)","('Commissioner',)",02/25/21,"('078294941111-90',)","Gavi, the Vaccine Alliance",Videoconference,discussion on covax and access to vaccines
5575,[],['Communication'],"('Pia Ahrenkilde Hansen',)","('Director-General',)",02/25/21,"('078294941111-90',)","Gavi, the Vaccine Alliance",Online,exchange of good communication practices.
5622,['Cabinet of Executive Vice-President Valdis Dombrovskis'],[],"('Andrea Beltramello',)","('Cabinet member',)",03/01/21,"('873067039520-87',)",Wilmar Europe Trading BV,Video call,deforestation and forest degradation
5623,['Cabinet of Commissioner Virginijus Sinkevičius'],[],"('Eglantine Cujo',)","('Cabinet member',)",03/01/21,"('873067039520-87',)",Wilmar Europe Trading BV,Virtual ,deforestation initiative and the impact on the palm oil countries producers
5664,['Cabinet of Commissioner Kadri Simson'],[],"('Peeter Kadarik', 'Thor-Sten Vertmann')","('Cabinet member', 'Cabinet member')",03/03/21,"('366117914426-10',)",Amazon Europe Core SARL,Video conference,"amazon's commitment to sustainability, renewable energy procurement and experience with corporate power purchase agreements and policies related to transportation electrification. goals of the climate pledge and the european green deal."
5665,['Cabinet of Commissioner Johannes Hahn'],[],"('Christiane Kirketerp De Viron',)","('Cabinet member',)",03/03/21,"('366117914426-10',)",Amazon Europe Core SARL,Conference call,data flows
5761,['Cabinet of Executive Vice-President Frans Timmermans'],[],"('Helena Braun',)","('Cabinet member',)",03/10/21,"('7574443768-34',)",Tetra Pak Group,video-call,european green deal and packaging.
5762,['Cabinet of Commissioner Virginijus Sinkevičius'],[],"('Rozalina Petrova',)","('Cabinet member',)",03/10/21,"('7574443768-34',)",Tetra Pak Group,Virtual,european green deal and packaging..
5869,['Cabinet of Commissioner Didier Reynders'],[],"('Geneviève Tuts', 'Lucrezia Busa')","('Cabinet member', 'Cabinet member')",03/18/21,"('61650796093-48',)",EUROMETAUX,Videoconference,"eu due diligence in supply chains"" - importance of the forthcoming eu legislation for the non-ferrous metals industry"
5870,['Cabinet of Commissioner Kadri Simson'],[],"('Kitti Nyitrai', 'Thor-Sten Vertmann')","('Cabinet member', 'Cabinet member')",03/18/21,"('61650796093-48',)",EUROMETAUX,Brussels (video conf),european metals industry and industrial electrification in new eu industrial strategy
5932,['Cabinet of Executive Vice-President Frans Timmermans'],[],"('Frans Timmermans',)","('Executive Vice-President',)",03/23/21,"('268958411031-65',)",European Business Summit Network,Brussels - videoconference,clean energy transition debate
5933,['Cabinet of Commissioner Mairead Mcguinness'],[],"('Mairead McGuinness', 'Katherine Power')","('Commissioner', 'Cabinet member')",03/23/21,"('268958411031-65',)",European Business Summit Network,Video Conferencing,opening address at clean energy summit 'how to couple finance and sustainability.
5983,['Cabinet of Commissioner Adina Vălean'],[],"('Adina-Ioana Vălean',)","('Commissioner',)",03/25/21,"('807912421050-91',)",Airlines for Europe,Conference Call,"	covid-19 travel restrictions, testing protocols and vaccination certificates. 
	aviation decarbonisation 
	air traffic management"
5984,['Cabinet of Commissioner Adina Vălean'],[],"('Adina-Ioana Vălean', 'Gaëlle Michelier')","('Commissioner', 'Cabinet member')",03/25/21,"('807912421050-91',)",Airlines for Europe,Online conference,conversation with a4e steering board
6107,['Cabinet of Commissioner Nicolas Schmit'],[],"('Nicolas Schmit', 'Christoph Nerlich', 'Anouk Faber')","('Commissioner', 'Cabinet member', 'Cabinet member')",04/12/21,"('06698681039-26',)",EUROPEAN TRADE UNION CONFEDERATION,Videoconference,meeting on the individual learning accounts (ila).
6108,['Cabinet of Vice-President Margaritis Schinas'],[],"('Maria Luisa Llano Cardenal', 'Margaritis Schinas')","('Cabinet member', 'Vice-President')",04/12/21,"('06698681039-26',)",EUROPEAN TRADE UNION CONFEDERATION,online,skills
6115,['Cabinet of Commissioner Nicolas Schmit'],[],"('Anouk Faber', 'Nicolas Schmit', 'Christoph Nerlich')","('Cabinet member', 'Commissioner', 'Cabinet member')",04/12/21,"('3978240953-79',)",BUSINESSEUROPE,Videoconference,meeting on the individual learning accounts (ila).
6116,['Cabinet of Vice-President Margaritis Schinas'],[],"('Maria Luisa Llano Cardenal', 'Margaritis Schinas')","('Cabinet member', 'Vice-President')",04/12/21,"('3978240953-79',)",BUSINESSEUROPE,online,skills
6178,['Cabinet of Executive Vice-President Frans Timmermans'],[],"('Riccardo Maggi',)","('Cabinet member',)",04/14/21,"('793038613858-32',)",Renewables Grid Initiative e.V.,Brussels - video conference,follow up to the offshore renewable energy strategy
6179,['Cabinet of Commissioner Kadri Simson'],[],"('Laure Chapuis-Kombos',)","('Cabinet member',)",04/14/21,"('793038613858-32',)",Renewables Grid Initiative e.V.,Video Conferencing,"to discuss the implementation of the offshore renewable energy strategy and how the offshore coalition for energy and nature's can support this, in particular with regards to the planned ""communities of practice""."
6229,['Cabinet of Executive Vice-President Margrethe Vestager'],[],"('Iwona Piorko Bermig', 'Margrethe Vestager')","('Cabinet member', 'Executive Vice-President')",04/19/21,"('55820581197-35',)",SMEunited aisbl,Online,industrial strategy
6230,['Cabinet of Commissioner Didier Reynders'],[],"('Lucrezia Busa', 'Didier Reynders')","('Cabinet member', 'Commissioner')",04/19/21,"('55820581197-35',)",SMEunited aisbl,Video conference,substainable corporate governance
6244,['Cabinet of Commissioner Mairead Mcguinness'],[],"('Tommy De Temmerman', 'Peter Power')","('Cabinet member', 'Cabinet member')",04/20/21,"('271912611231-56',)",Deutsche Bank AG,video call,"basel iii, covid response, ccps"
6245,['Cabinet of Commissioner Mairead Mcguinness'],[],"('Tommy De Temmerman', 'Nathalie De Basaldua Lemarchand')","('Cabinet member', 'Cabinet member')",04/20/21,"('271912611231-56',)",Deutsche Bank AG,Brussels,"open strategic autonomy, covid-19 response, basel iii, ccps"
6253,['Cabinet of Commissioner Adina Vălean'],[],"('Elzbieta Lukaniuk', 'Pablo Fabregas Martinez')","('Cabinet member', 'Cabinet member')",04/20/21,"('76903725494-68',)",Association Européenne des Concessionnaires d'Autoroutes et d'Ouvrages à Péage,Conference call,"sustainable and smart mobility policy orientation with a focus on road safety action plan,  its and ten-t revision proposals."
6254,['Cabinet of Commissioner Adina Vălean'],[],"('Pablo Fabregas Martinez',)","('Cabinet member',)",04/20/21,"('76903725494-68',)",Association Européenne des Concessionnaires d'Autoroutes et d'Ouvrages à Péage,conference call ,transport
6265,['Cabinet of Executive Vice-President Frans Timmermans'],[],"('Lukas Visek',)","('Cabinet member',)",04/21/21,"('542451235684-35',)",The Good Food Institute Europe (Belgium),Brussels - video conference,discussion on cultivated meat
6266,['Cabinet of Commissioner Stella Kyriakides'],[],"('Annukka Ojala',)","('Cabinet member',)",04/21/21,"('542451235684-35',)",The Good Food Institute Europe (Belgium),Brussels,vc meeting - alternative proteins in f2f
6334,['Cabinet of Commissioner Mairead Mcguinness'],[],"('Tommy De Temmerman',)","('Cabinet member',)",04/26/21,"('799142914971-03',)","Banco Santander, S.A.",Video call,"basel iii, covid response"
6335,['Cabinet of Commissioner Mairead Mcguinness'],[],"('Tommy De Temmerman',)","('Cabinet member',)",04/26/21,"('799142914971-03',)","Banco Santander, S.A.",virtual call,state of play covid19- guaranteed loans in spain and other support measures
6388,['Cabinet of Executive Vice-President Valdis Dombrovskis'],[],"('Andrea Beltramello',)","('Cabinet member',)",04/28/21,"('78787381113-69',)",BNP PARIBAS,video conference,basel implementation
6389,['Cabinet of Commissioner Mairead Mcguinness'],[],"('Tommy De Temmerman',)","('Cabinet member',)",04/28/21,"('78787381113-69',)",BNP PARIBAS,virtual call,open strategic autonomy
6430,['Cabinet of Executive Vice-President Margrethe Vestager'],[],"('Werner Stengg', 'Margrethe Vestager')","('Cabinet member', 'Executive Vice-President')",04/30/21,"('7459401905-60',)",Intel Corporation,Brussels,"eu's digital transition, the eu's digital transition, the processor and semiconductor ecosystem in europe in europe"
6431,['Cabinet of Commissioner Thierry Breton'],[],"('Fabrice Comptour', 'Thierry Breton')","('Cabinet member', 'Commissioner')",04/30/21,"('7459401905-60',)",Intel Corporation,"Brussels, Belgium","eu's digital transition, the processor and semiconductor ecosystem in europe"
6457,['Cabinet of Executive Vice-President Margrethe Vestager'],[],"('Werner Stengg',)","('Cabinet member',)",05/04/21,"('64270747023-20',)",DIGITALEUROPE,Online ,sustainable corporate governance initiative
6458,['Cabinet of Commissioner Thierry Breton'],[],"('Pauline Weinzierl', 'Filomena Chirico')","('Cabinet member', 'Cabinet member')",05/04/21,"('64270747023-20',)",DIGITALEUROPE,Videoconference,transatlantic relationship
6474,['Cabinet of Vice-President Maroš Šefčovič'],[],"('Maroš Šefčovič',)","('Executive Vice-President',)",05/05/21,"('3978240953-79',)",BUSINESSEUROPE,online,implications of the implementation of the trade and cooperation agreement for eu-uk trade
6475,['Cabinet of Vice-President Věra Jourová'],[],"('Věra Jourová',)","('Vice-President',)",05/05/21,"('3978240953-79',)",BUSINESSEUROPE,Videoconference,"sustainable corporate governance, due diligence and eu consumer agenda"
6511,['Cabinet of Commissioner Thierry Breton'],[],"('Joan Canton',)","('Cabinet member',)",05/07/21,"('0649790813-47',)",Association des Constructeurs Européens d'Automobiles,Videoconference,preparatory meeting for the 19/5 meeting between commissioner breton and acea
6512,['Cabinet of Commissioner Thierry Breton'],[],"('Pauline Weinzierl',)","('Cabinet member',)",05/07/21,"('0649790813-47',)",Association des Constructeurs Européens d'Automobiles,Videoconference,review of the steel safeguards measures
6604,['Cabinet of Commissioner Mairead Mcguinness'],[],"('Katherine Power',)","('Cabinet member',)",05/18/21,"('3978240953-79',)",BUSINESSEUROPE,Virtual,taxonomy article 8 disclosures delegated act
6605,['Cabinet of President Ursula von der Leyen'],[],"('Valeria Miceli',)","('Cabinet member',)",05/18/21,"('3978240953-79',)",BUSINESSEUROPE,Brussels,taxonomy delegated act (art 8)
6722,['Cabinet of Executive Vice-President Margrethe Vestager'],[],"('Werner Stengg',)","('Cabinet member',)",05/28/21,"('0801162959-21',)",Microsoft Corporation,Online ,data privacy
6723,['Cabinet of Commissioner Thierry Breton'],[],"('Valere Moutarlier', 'Agnieszka Skonieczna', 'Filomena Chirico')","('Cabinet member', 'Cabinet member', 'Cabinet member')",05/28/21,"('0801162959-21',)",Microsoft Corporation,video conference,"discussions on cloud, platforms and ai regulation"
