,Name of cabinet,Name of DG,EC member,Title of EC representative,Date,TR ID,Name of interest representative,Location,Subject
2,['Cabinet of Vice-President Věra Jourová'],[],"('Daniel Braun', 'Renate Nikolay', 'Věra Jourová')","('Cabinet member', 'Cabinet member', 'Vice-President')",12/02/19,"('28666427835-74',)",Meta Platforms Ireland Limited and its various subsidiaries,"Brussels, Belgium","code of practice, gdpr"
3,[],"['Communications Networks, Content and Technology']","('Roberto Viola',)","('Director-General',)",12/02/19,"('28666427835-74',)",Meta Platforms Ireland Limited and its various subsidiaries,Brussels,platforms and dsa
18,['Cabinet of President Ursula von der Leyen'],[],"('Anthony Whelan',)","('Cabinet member',)",12/03/19,"('28666427835-74',)",Meta Platforms Ireland Limited and its various subsidiaries,"Brussels, Belgium","advertising, data, artificial intelligence, illegal content and disinformation"
19,['Cabinet of Executive Vice-President Valdis Dombrovskis'],[],"('Valdis Dombrovskis ', 'Andrea Beltramello')","('Executive Vice-President', 'Cabinet member')",12/03/19,"('28666427835-74',)",Meta Platforms Ireland Limited and its various subsidiaries,"Brussels, Belgium","crytpo-assets, including stablecoins"
48,[],"['Communications Networks, Content and Technology']","('Roberto Viola',)","('Director-General',)",12/04/19,"('8999533555-91',)",Robert Bosch GmbH,Brussels,ai - data economy
49,['Cabinet of Executive Vice-President Margrethe Vestager'],[],"('Margrethe Vestager',)","('Executive Vice-President',)",12/04/19,"('8999533555-91',)",Robert Bosch GmbH,Brussels,meeting with ceo of bosch
50,['Cabinet of Commissioner Mariya Gabriel'],[],"('Mariya Gabriel',)","('Commissioner',)",12/04/19,"('8999533555-91',)",Robert Bosch GmbH,Brussels,research and innovation
106,['Cabinet of Commissioner Mariya Gabriel'],[],"('Mariya Gabriel',)","('Commissioner',)",12/11/19,"('2732167674-76',)",Airbus,Brussels ,horizon europe and the aviation sector
107,"['Cabinet of Commissioner Nicolas Schmit', 'Cabinet of Commissioner Nicolas Schmit']",[],"('Antoine Kasel', 'Christoph Nerlich', 'Anouk Faber', 'Santina Bertulessi', 'Antoine Kasel', 'Nicolas Schmit')","('Cabinet member', 'Cabinet member', 'Cabinet member', 'Cabinet member', 'Cabinet member', 'Commissioner')",12/11/19,"('2732167674-76',)",Airbus,Brussels,skills
108,['Cabinet of Commissioner Phil Hogan'],[],"('Phil Hogan', 'Cristina Rueda Catry', 'Agnieszka Drzewoska')","('Commissioner', 'Cabinet member', 'Cabinet member')",12/11/19,"('2732167674-76',)",Airbus,Brussels,state of play of the latest development of the airbus/boeing litigation
109,['Cabinet of Commissioner Jutta Urpilainen'],[],"('Arto Virtanen', 'Jutta Urpilainen')","('Cabinet member', 'Commissioner')",12/11/19,"('508695011366-29', '907583825189-14')","The Central Organisation of Finnish Trade Unions SAK,STTK ry",Brussels,development policy
110,[],"['Employment, Social Affairs and Inclusion']","('Joost Korte',)","('Director-General',)",12/11/19,"('508695011366-29', '907583825189-14')","The Central Organisation of Finnish Trade Unions SAK,STTK ry",Brussels,meeting with sak and sttk
111,['Cabinet of Commissioner Nicolas Schmit'],[],"('Nicolas Schmit', 'Antoine Kasel', 'Santina Bertulessi', 'Ana Carla  Pereira', 'Anouk Faber')","('Commissioner', 'Cabinet member', 'Cabinet member', 'Cabinet member', 'Cabinet member')",12/11/19,"('508695011366-29', '907583825189-14')","The Central Organisation of Finnish Trade Unions SAK,STTK ry",Brussels,minimum wage and collective bargaining
116,['Cabinet of Vice-President Věra Jourová'],[],"('Daniel Braun',)","('Cabinet member',)",12/11/19,"('7721359944-96',)",IBM Corporation,"Brussels, Belgium",conference on digital europe
117,['Cabinet of Commissioner Mariya Gabriel'],[],"('Adrienn Kiraly',)","('Cabinet member',)",12/11/19,"('7721359944-96',)",IBM Corporation,Brussels,horizon europe - digital industry and digital education
118,['Cabinet of Commissioner Phil Hogan'],[],"('Agnieszka Drzewoska', 'Cristina Rueda Catry', 'Phil Hogan')","('Cabinet member', 'Cabinet member', 'Commissioner')",12/11/19,"('7721359944-96',)",IBM Corporation,Brussels,presentation of ibm's point of view on digital trade and the priorities of the new commission
124,['Cabinet of Commissioner Kadri Simson'],[],"('Stefano Grassi', 'Kitti Nyitrai', 'Kadri Simson')","('Cabinet member', 'Cabinet member', 'Commissioner')",12/11/19,"('923424020779-19',)",Rasmussen Global,Brussels,"european green deal, energy security"
125,['Cabinet of High Representative Josep Borrell Fontelles'],[],"('Josep Borrell Fontelles',)","('High Representative',)",12/11/19,"('923424020779-19',)",Rasmussen Global,Brussels,security and defence issues
137,[],['Mobility and Transport'],"('Henrik Hololei',)","('Director-General',)",12/12/19,"('614220318268-60',)",EU-ASEAN Business Council,"Brussels, Belgium",eu-asean cooperation
138,['Cabinet of Commissioner Phil Hogan'],[],"('Dermot Ryan', 'Phil Hogan')","('Cabinet member', 'Commissioner')",12/12/19,"('614220318268-60',)",EU-ASEAN Business Council,Brussels,trade issues
241,[],['Climate Action'],"('Mauro Raffaele Petriccione',)","('Director-General',)",01/13/20,"('291219715847-52',)",easyJet,Brussels,developments for the aviation sector
242,[],['Taxation and Customs Union'],"('Stephen Quest',)","('Director-General',)",01/13/20,"('291219715847-52',)",easyJet,"Brussels, Belgium",sustainability in aviation
256,['Cabinet of Commissioner Stella Kyriakides'],[],"('Roberto Reig Rodrigo',)","('Cabinet member',)",01/14/20,"('1414929419-24',)",WWF European Policy Programme,Brussels,discussion on discussion on eu biodiversity policy
257,['Cabinet of Executive Vice-President Frans Timmermans'],[],"('Helena Braun',)","('Cabinet member',)",01/14/20,"('1414929419-24',)",WWF European Policy Programme,Brussels,discussion on eu biodiversity policy
268,[],['Mobility and Transport'],"('Henrik Hololei',)","('Director-General',)",01/15/20,"('283792032249-12',)",SOCIETE DES GRANDS PROJETS,"Brussels, Belgium",grand paris express
269,['Cabinet of Commissioner Adina Vălean'],[],"('Pablo Fabregas Martinez',)","('Cabinet member',)",01/15/20,"('283792032249-12',)",SOCIETE DES GRANDS PROJETS,Brussels,transports
293,['Cabinet of Executive Vice-President Frans Timmermans'],[],"('Aleksandra Tomczak',)","('Cabinet member',)",01/16/20,"('64869491516-70',)",Stichting European Climate Foundation,Brussels,coal phase out study discussion
294,['Cabinet of Commissioner Kadri Simson'],[],"('Helena Hinto',)","('Cabinet member',)",01/16/20,"('64869491516-70',)",Stichting European Climate Foundation,Brussels,"introduction of a study on just transition in coal phase-out in bg, ro, el"
322,[],"['Internal Market, Industry, Entrepreneurship and SMEs', 'Defence Industry and Space']","('Timo Pesonen', 'Timo Pesonen')","('Acting Director-General', 'Director-General')",01/17/20,"('977869932377-59',)",European Association of Research and Technology Organisations,Brussels,exchange of views on horizon 2020
323,[],['Research and Innovation'],"('Jean-Eric Paquet',)","('Director-General',)",01/17/20,"('977869932377-59',)",European Association of Research and Technology Organisations,Brussels,recommendations for european rdandi policy post-2020
325,['Cabinet of Executive Vice-President Margrethe Vestager'],[],"('Margrethe Vestager',)","('Executive Vice-President',)",01/20/20,"('03181945560-59',)",Google,Brussels,digital policy
326,['Cabinet of Executive Vice-President Frans Timmermans'],[],"('Frans Timmermans',)","('Executive Vice-President',)",01/20/20,"('03181945560-59',)",Google,Brussels,opportunities and responsibility of digital technology for green deal
328,['Cabinet of Executive Vice-President Margrethe Vestager'],[],"('Margrethe Vestager',)","('Executive Vice-President',)",01/20/20,"('0801162959-21',)",Microsoft Corporation,Brussels,digital policy
329,['Cabinet of Vice-President Věra Jourová'],[],"('Renate Nikolay', 'Věra Jourová', 'Wojtek Talko', 'Daniel Braun')","('Cabinet member', 'Vice-President', 'Cabinet member', 'Cabinet member')",01/20/20,"('0801162959-21',)",Microsoft Corporation,"Brussels, Belgium","disinformation, artificial intelligence"
330,"['Cabinet of Commissioner Didier Reynders', 'Cabinet of Commissioner Didier Reynders']",[],"('Didier Reynders', 'Isabelle Perignon', 'Lucrezia Busa')","('Commissioner', 'Cabinet member', 'Cabinet member')",01/20/20,"('0801162959-21',)",Microsoft Corporation,Brussels,"e-evidence, ai"
331,['Cabinet of Commissioner Ylva Johansson'],[],"('Ylva Johansson', 'Tom Snels', 'Monika Maglione')","('Commissioner', 'Cabinet member', 'Cabinet member')",01/20/20,"('0801162959-21',)",Microsoft Corporation,Brussels ,"eu internal security: challenges ahead and law enforcement cooperation, perspectives from the industry."
356,['Cabinet of Executive Vice-President Frans Timmermans'],[],"('Antoine Colombani',)","('Cabinet member',)",01/21/20,"('09245221105-30',)",Fédération bancaire française,Brussels,discussion on sustainable finance
357,['Cabinet of Commissioner Paolo Gentiloni'],[],"('Alienor Margerit',)","('Cabinet member',)",01/21/20,"('09245221105-30',)",Fédération bancaire française,"Brussels, BE",fr banks and energy transition
361,['Cabinet of President Ursula von der Leyen'],[],"('Anthony Whelan',)","('Cabinet member',)",01/21/20,"('1771817758-48',)",Bundesverband der Deutschen Industrie e.V.,"Brussels, Belgium","5g, artificial intelligence, secure data"
362,[],"['Communications Networks, Content and Technology']","('Roberto Viola',)","('Director-General',)",01/21/20,"('1771817758-48',)",Bundesverband der Deutschen Industrie e.V.,Brussels,"challenges facing new commission, ai, digital soverignty, connectivity and cloud"
363,['Cabinet of Commissioner Didier Reynders'],[],"('Geneviève Tuts',)","('Cabinet member',)",01/21/20,"('1771817758-48',)",Bundesverband der Deutschen Industrie e.V.,Brussels,commissioner reynders' priorities
369,[],"['Internal Market, Industry, Entrepreneurship and SMEs', 'Defence Industry and Space']","('Timo Pesonen', 'Timo Pesonen')","('Acting Director-General', 'Director-General')",01/21/20,"('2732167674-76',)",Airbus,Brussels,exchange of views on eu space regulation
370,[],"['Communications Networks, Content and Technology']","('Roberto Viola',)","('Director-General',)",01/21/20,"('2732167674-76',)",Airbus,Brussels,quantum communication infrastructure and ai/data economy
379,['Cabinet of Executive Vice-President Valdis Dombrovskis'],[],"('Ruth Paserman', 'Elina Melngaile')","('Cabinet member', 'Cabinet member')",01/21/20,"('3978240953-79',)",BUSINESSEUROPE,Brussels,"eu - china strategy, development cooperation"
380,['Cabinet of Commissioner Kadri Simson'],[],"('Kadri Simson', 'Stefano Grassi', 'Thor-Sten Vertmann')","('Commissioner', 'Cabinet member', 'Cabinet member')",01/21/20,"('3978240953-79',)",BUSINESSEUROPE,Brussels,"eu industrial competitiveness, carbon pricing mechanism"
408,['Cabinet of Commissioner Nicolas Schmit'],[],"('Nicolas Schmit', 'Antoine Kasel')","('Commissioner', 'Cabinet member')",01/22/20,"('002278013515-26',)",Uber,Davos,skills agenda/platform workers
409,['Cabinet of Commissioner Adina Vălean'],[],"('Pablo Fabregas Martinez',)","('Cabinet member',)",01/22/20,"('002278013515-26',)",Uber,Brussels,transports
410,['Cabinet of Commissioner Helena Dalli'],[],"('Neil Kerr',)","('Cabinet member',)",01/22/20,"('002278013515-26',)",Uber,"Brussels, Belgium",uber's actions in diversity and safety
428,['Cabinet of Executive Vice-President Frans Timmermans'],[],"('Daniel Mes',)","('Cabinet member',)",01/22/20,"('389561426715-93',)",Freight Transport Association Ireland,Brussels,green deal and road transport
429,['Cabinet of Commissioner Adina Vălean'],[],"('Filip Alexandru Negreanu Arboreanu',)","('Cabinet member',)",01/22/20,"('389561426715-93',)",Freight Transport Association Ireland,Brussels,logistics and freight transport and green deal
437,['Cabinet of President Ursula von der Leyen'],[],"('Fernando Sampedro Marcos',)","('Cabinet member',)",01/22/20,"('52431421-12',)","Telefonica, S.A.",Brussels,digital agenda
438,['Cabinet of High Representative Josep Borrell Fontelles'],[],"('Nereo Penalver Garcia',)","('Cabinet member',)",01/22/20,"('52431421-12',)","Telefonica, S.A.",Brussels,european digital policy
439,['Cabinet of Executive Vice-President Margrethe Vestager'],[],"('Alejandro Cainzos',)","('Cabinet member',)",01/22/20,"('52431421-12',)","Telefonica, S.A.",Brussels ,external digital connectivity
474,[],['Mobility and Transport'],"('Henrik Hololei',)","('Director-General',)",01/23/20,"('117431210021-77',)",CONFTRASPORTO,"Brussels, Belgium",position paper on green deal
475,['Cabinet of Commissioner Adina Vălean'],[],"('Pablo Fabregas Martinez',)","('Cabinet member',)",01/23/20,"('117431210021-77',)",CONFTRASPORTO,Brussels,transports
483,['Cabinet of Executive Vice-President Frans Timmermans'],[],"('Daniel Mes',)","('Cabinet member',)",01/23/20,"('269727723042-29',)",AVERE - The European Association for Electromobility,Brussels,opportunities and challenges for electromobility
484,['Cabinet of Commissioner Adina Vălean'],[],"('Elzbieta Lukaniuk',)","('Cabinet member',)",01/23/20,"('269727723042-29',)",AVERE - The European Association for Electromobility,Brussels,transports
487,['Cabinet of Vice-President Dubravka Šuica'],[],"('Astrid Dentler',)","('Cabinet member',)",01/23/20,"('38526121292-88',)",European Federation of Pharmaceutical Industries and Associations,Brussels,"integrated health solutions, active ageing, sustainability and quality of healthcare systems, long-term visions on healthcare"
488,['Cabinet of Commissioner Phil Hogan'],[],"('Dermot Ryan',)","('Cabinet member',)",01/23/20,"('38526121292-88',)",European Federation of Pharmaceutical Industries and Associations,Brussels,presentation efpia's manifesto
498,"['Cabinet of Commissioner Paolo Gentiloni', 'Cabinet of Executive Vice-President Valdis Dombrovskis']",[],"('Paolo Gentiloni', 'Valdis Dombrovskis ')","('Commissioner', 'Executive Vice-President')",01/23/20,"('588327811384-96',)",Apple Inc.,"Davos, Switzerland",digital taxation
499,['Cabinet of Executive Vice-President Frans Timmermans'],[],"('Frans Timmermans',)","('Executive Vice-President',)",01/23/20,"('588327811384-96',)",Apple Inc.,"Davos, Switzerland",opportunities and collaboration on the green deal
500,['Cabinet of Commissioner Phil Hogan'],[],"('Kevin Keary', 'Phil Hogan')","('Cabinet member', 'Commissioner')",01/23/20,"('588327811384-96',)",Apple Inc.,Davos,trade issues
517,['Cabinet of Executive Vice-President Margrethe Vestager'],[],"('Werner Stengg',)","('Cabinet member',)",01/23/20,"('977881918839-35',)",International Association of Privacy Professionals,Brussels,data protection
518,['Cabinet of Commissioner Didier Reynders'],[],"('Geneviève Tuts', 'Lucrezia Busa')","('Cabinet member', 'Cabinet member')",01/23/20,"('977881918839-35',)",International Association of Privacy Professionals,Brussels,general presentation of the activities of the group
531,['Cabinet of Vice-President Věra Jourová'],[],"('Věra Jourová', 'Marie Frenay')","('Vice-President', 'Cabinet member')",01/24/20,"('612547127497-45',)",Reporters sans frontières,"Brussels, Belgium",media freedom and media pluralism
532,[],['Foreign Policy Instruments'],"('Hilde Hardeman',)","('Head of service',)",01/24/20,"('612547127497-45',)",Reporters sans frontières,Brussels,partenariat international sur l'information et la democratie.
533,['Cabinet of Commissioner Mariya Gabriel'],[],"('Chiara Salvelli',)","('Cabinet member',)",01/24/20,"('612547127497-45',)",Reporters sans frontières,brussels,press freedom and journalism in europe
537,['Cabinet of Commissioner Mariya Gabriel'],[],"('Dara Murphy',)","('Cabinet member',)",01/24/20,"('84973761187-60',)",EuroCommerce,Brussels,discuss greater research and innovation in european retail
538,['Cabinet of Commissioner Virginijus Sinkevičius'],[],"('Marius  Vaščega\xa0',)","('Cabinet member',)",01/24/20,"('84973761187-60',)",EuroCommerce,Brussels,introductory meeting to highlight key policy tasks
547,['Cabinet of Commissioner Adina Vălean'],[],"('Walter Goetz',)","('Cabinet member',)",01/27/20,"('191419916889-22',)",NV Nederlandse Spoorwegen,Brussels,rail sector and the green deal
548,['Cabinet of Executive Vice-President Frans Timmermans'],[],"('Frans Timmermans',)","('Executive Vice-President',)",01/27/20,"('191419916889-22',)",NV Nederlandse Spoorwegen,Brussels,rail sector and the green deal sector and the green deal
567,['Cabinet of Executive Vice-President Margrethe Vestager'],[],"('Christiane Canenbley', 'Werner Stengg')","('Cabinet member', 'Cabinet member')",01/28/20,"('061601915428-87',)",ITI - The Information Technology Industry Council,Brussels,"introduction association, artificial intelligence and data strategy, digital services act"
568,['Cabinet of President Ursula von der Leyen'],[],"('Anthony Whelan',)","('Cabinet member',)",01/28/20,"('061601915428-87',)",ITI - The Information Technology Industry Council,"Brussels, Belgium","overall digital policy, including technological sovereignty, open multilateral economic governance, trade in technology, data strategy"
569,['Cabinet of Commissioner Thierry Breton'],[],"('Filomena Chirico',)","('Cabinet member',)",01/28/20,"('061601915428-87',)",ITI - The Information Technology Industry Council,Brussels,"priorities for tech regulation, single market and enforcement"
570,['Cabinet of Commissioner Virginijus Sinkevičius'],[],"('Marius  Vaščega\xa0',)","('Cabinet member',)",01/28/20,"('075071719925-75',)",Hewlett Packard Enterprise,Brussels,exchange of views on the next circular economy action plan.
571,[],['Environment'],"('Daniel Calleja Crespo',)","('Director-General',)",01/28/20,"('075071719925-75',)",Hewlett Packard Enterprise,Brussels,sustainability and ecodesign for printers
580,['Cabinet of Commissioner Kadri Simson'],[],"('Laure Chapuis-Kombos', 'Kadri Simson', 'Thor-Sten Vertmann', 'Stefano Grassi')","('Cabinet member', 'Commissioner', 'Cabinet member', 'Cabinet member')",01/28/20,"('25487567824-45',)",European Round Table for Industry,Brussels,"european green deal, sector integration, energy efficiency, industrial strategy"
581,['Cabinet of Commissioner Phil Hogan'],[],"('Phil Hogan',)","('Commissioner',)",01/28/20,"('25487567824-45',)",European Round Table for Industry,Brussels,trade issues
604,['Cabinet of Executive Vice-President Frans Timmermans'],[],"('Antoine Colombani',)","('Cabinet member',)",01/28/20,"('957105437070-49',)",Responsible Business Alliance,Brussels,discussion on due diligence in supply chains
605,['Cabinet of Commissioner Didier Reynders'],[],"('Lucrezia Busa', 'Didier Reynders')","('Cabinet member', 'Commissioner')",01/28/20,"('957105437070-49',)",Responsible Business Alliance,Brussels,general presentation of the their activities and their future events
614,['Cabinet of Executive Vice-President Margrethe Vestager'],[],"('Alina-Stefania Ujupan', 'Kim Jorgensen')","('Cabinet member', 'Cabinet member')",01/29/20,"('17909506129-41',)",EUROGAS,Brussels ,"energy transition and energy transition and green deal, investment plan, renewable energy"
615,['Cabinet of Commissioner Janez Lenarčič'],[],"('Natalie Pauwels',)","('Cabinet member',)",01/29/20,"('17909506129-41',)",EUROGAS,Brussels,"energy transition and green deal, investment plan, renewable energy"
616,['Cabinet of Commissioner Johannes Hahn'],[],"('Kyriacos Charalambous',)","('Cabinet member',)",01/29/20,"('17909506129-41',)",EUROGAS,Brussels,"energy transition and green deal, investment plan, renewable energy, investment plan, renewable energy"
617,['Cabinet of Commissioner Paolo Gentiloni'],[],"('Alienor Margerit',)","('Cabinet member',)",01/29/20,"('17909506129-41',)",EUROGAS,"Brussels, BE","role of gas in the energy transition and the energy transition and green deal, investment plan, renewable energy"
618,['Cabinet of Commissioner Janusz Wojciechowski'],[],"('Simona Pinzariu', 'Jorge Pinto Antunes')","('Cabinet member', 'Cabinet member')",01/29/20,"('17909506129-41',)",EUROGAS,Brussels,"the role of gas in the energy transition and the energy transition and green deal, investment plan, renewable energy."
622,['Cabinet of President Ursula von der Leyen'],[],"('Kurt Vandenberghe',)","('Cabinet member',)",01/29/20,"('3954187491-70',)",International Association of Oil & Gas Producers Europe,Brussels,european green deal
623,['Cabinet of Commissioner Johannes Hahn'],[],"('Kyriacos Charalambous',)","('Cabinet member',)",01/29/20,"('3954187491-70',)",International Association of Oil & Gas Producers Europe,Brussels,"green deal, investment plan, renewable energy"
639,['Cabinet of Commissioner Thierry Breton'],[],"('Valere Moutarlier', 'Pauline Weinzierl')","('Cabinet member', 'Cabinet member')",01/29/20,"('84973761187-60',)",EuroCommerce,Brussels,"discussion on the priorities of the new commission of relevance to the retail sector, implementation of key legislation and key barriers faced by the sector across the eu and in specific markets"
640,['Cabinet of Vice-President Věra Jourová'],[],"('Věra Jourová', 'Eduard Hulicius')","('Vice-President', 'Cabinet member')",01/29/20,"('84973761187-60',)",EuroCommerce,"Brussels, Belgium","rule of law, consumer protection"
642,['Cabinet of Executive Vice-President Frans Timmermans'],[],"('Frans Timmermans',)","('Executive Vice-President',)",01/29/20,"('93038071152-83',)",The European Steel Association,Brussels,steel sector and the green deal
643,['Cabinet of Commissioner Phil Hogan'],[],"('Agnieszka Drzewoska', 'Phil Hogan')","('Cabinet member', 'Commissioner')",01/29/20,"('93038071152-83',)",The European Steel Association,Brussels,trade issues
678,['Cabinet of Commissioner Adina Vălean'],[],"('Adina-Ioana Vălean',)","('Commissioner',)",01/30/20,"('78891371297-34',)",European Transport Safety Council,Brussels,"introductory meeting with mr. antonio avenoso, executive director"
679,['Cabinet of Commissioner Adina Vălean'],[],"('Walter Goetz',)","('Cabinet member',)",01/30/20,"('78891371297-34',)",European Transport Safety Council,brussels ,transport
680,['Cabinet of Executive Vice-President Valdis Dombrovskis'],[],"('Michael Hager', 'Jérôme Deslandes')","('Cabinet member', 'Cabinet member')",01/30/20,"('799142914971-03',)","Banco Santander, S.A.",Brussels,"-discussion of multiple point of entry resolution strategy, basel iii's approach to operational risk"
681,[],"['Financial Stability, Financial Services and Capital Markets Union']","('John Berrigan',)","('Director-General',)",01/30/20,"('799142914971-03',)","Banco Santander, S.A.",Brussels,"capital markets, banking union"
682,[],['Environment'],"('Daniel Calleja Crespo',)","('Director-General',)",01/30/20,"('799142914971-03',)","Banco Santander, S.A.",Brussels,sustainability and green deal
689,['Cabinet of Executive Vice-President Frans Timmermans'],[],"('Frans Timmermans',)","('Executive Vice-President',)",01/31/20,"('0649790813-47',)",Association des Constructeurs Européens d'Automobiles,Brussels,green deal and car industry
690,['Cabinet of Commissioner Phil Hogan'],[],"('Phil Hogan',)","('Commissioner',)",01/31/20,"('0649790813-47',)",Association des Constructeurs Européens d'Automobiles,Brussels,trade issues
697,[],['European Anti-Fraud Office'],"('Ville Itälä',)","('Director-General',)",01/31/20,"('501222919-71',)",Transparency International Liaison Office to the European Union,"Budapest, Hungary",fight against fraud and corruption
698,[],['European Anti-Fraud Office'],"('Ville Itälä',)","('Director-General',)",01/31/20,"('501222919-71',)",Transparency International Liaison Office to the European Union,"Budapest, Hungary",protection of the european union's financial interests: olaf's role
743,['Cabinet of Vice-President Věra Jourová'],[],"('Věra Jourová', 'Wojtek Talko', 'Daniel Braun')","('Vice-President', 'Cabinet member', 'Cabinet member')",02/04/20,"('03181945560-59',)",Google,"Brussels, Belgium",ec digital priorities
744,['Cabinet of Commissioner Ylva Johansson'],[],"('Tom Snels', 'Monika Maglione')","('Cabinet member', 'Cabinet member')",02/04/20,"('03181945560-59',)",Google,Brussels,eu internal security: cooperation with the industry in the fight against terrorism and child abuse online.
745,['Cabinet of Commissioner Nicolas Schmit'],[],"('Nicolas Schmit', 'Fabien Dell', 'Antoine Kasel', 'Anouk Faber')","('Commissioner', 'Cabinet member', 'Cabinet member', 'Cabinet member')",02/04/20,"('03181945560-59',)",Google,Brussels,skills
768,['Cabinet of Executive Vice-President Margrethe Vestager'],[],"('Margrethe Vestager', 'Werner Stengg')","('Executive Vice-President', 'Cabinet member')",02/04/20,"('582824527068-76',)",Suomen itsenäisyyden juhlarahasto,Brussels,digital policy
769,['Cabinet of Executive Vice-President Margrethe Vestager'],[],"('Alina-Stefania Ujupan', 'Werner Stengg')","('Cabinet member', 'Cabinet member')",02/04/20,"('582824527068-76',)",Suomen itsenäisyyden juhlarahasto,Brussels,fair data economy
772,"['Cabinet of Executive Vice-President Margrethe Vestager', 'Cabinet of Commissioner Thierry Breton']",[],"('Werner Stengg', 'Margrethe Vestager', 'Filomena Chirico', 'Thierry Breton', 'Agnieszka Skonieczna')","('Cabinet member', 'Executive Vice-President', 'Cabinet member', 'Commissioner', 'Cabinet member')",02/04/20,"('62536168216-12',)",Sky Group,Brussels,digital policy
773,['Cabinet of Executive Vice-President Frans Timmermans'],[],"('Frans Timmermans',)","('Executive Vice-President',)",02/04/20,"('62536168216-12',)",Sky Group,Brussels,"sustainability, plastics and the green deal"
781,[],['Trade'],"('Sabine Weyand',)","('Director-General',)",02/04/20,"('7749519702-29',)",Bundesvereinigung der Deutschen Arbeitgeberverbände e.V.,Brussels,"eu trade agenda, future relationship with the uk, eu ftas, us, china"
