10474,['Cabinet of Executive Vice-President Margrethe Vestager'],[],"('Alejandro Cainzos',)","('Cabinet member',)",06/10/22,"('240029014014-18',)",Broadcom,Brussels,digital policies.
10494,['Cabinet of Commissioner Nicolas Schmit'],[],"('Ana Carla  Pereira', 'Christoph Nerlich')","('Cabinet member', 'Cabinet member')",06/13/22,"('48544465107-88',)",DHL Group,Bruxelles ,meeting on skills and european pillar of social rights
10495,['Cabinet of Vice-President Věra Jourová'],[],"('Wojtek Talko', 'Simona Constantin')","('Cabinet member', 'Cabinet member')",06/13/22,"('48544465107-88',)",DHL Group,Brussels,sustainable corporate governance
10503,['Cabinet of Executive Vice-President Margrethe Vestager'],[],"('Penelope Papandropoulos',)","('Cabinet member',)",06/13/22,"('92442218459-37',)","AT&T, Inc.",Brussels,"telco infrastructure and investment, ott 'fair share', eu-eu cooperation on digital files, ttc."
10504,['Cabinet of Commissioner Adina Vălean'],[],"('Adina-Ioana Vălean', 'Roxana Lesovici', 'Filip Alexandru Negreanu Arboreanu')","('Commissioner', 'Cabinet member', 'Cabinet member')",06/13/22,"('92442218459-37',)","AT&T, Inc.",Brussels,transport
10507,['Cabinet of Executive Vice-President Margrethe Vestager'],[],"('Werner Stengg',)","('Cabinet member',)",06/14/22,"('141376015883-52',)",Kaupan liitto ry - Finnish Commerce Federation,Brussels,"data act, ai act."
10508,['Cabinet of Commissioner Thierry Breton'],[],"('Elina Laurinen',)","('Cabinet member',)",06/14/22,"('141376015883-52',)",Kaupan liitto ry - Finnish Commerce Federation,"Brussels, Belgium",digital trade and sustainable consumption
10509,['Cabinet of Commissioner Didier Reynders'],[],"('Isabelle Perignon',)","('Cabinet member',)",06/14/22,"('141376015883-52',)",Kaupan liitto ry - Finnish Commerce Federation,Brussels,sustainable consumption and consumer protection law'
10520,['Cabinet of Commissioner Thierry Breton'],[],"('Joan Canton',)","('Cabinet member',)",06/14/22,"('64879142323-90',)",European Chemical Industry Council,"Brussels, Belgium","implementation chemicals strategy, transition pathway for chemicals sector"
10521,[],['Economic and Financial Affairs'],"('Maarten Verwey',)","('Director-General',)",06/14/22,"('64879142323-90',)",European Chemical Industry Council,Brussels,"meeting with paul de krom, chair of the dutch chemical industry council"
10553,['Cabinet of Commissioner Olivér Várhelyi'],[],"('Olivér Várhelyi',)","('Commissioner',)",06/15/22,"('79019799690-13',)",KfW Bankengruppe,berl,"- support to ukraine
- efsd+ guarantee call for proposal
- western balkans  energy sector crisis
- horizontal issues in delegation agreements"
10554,['Cabinet of Executive Vice-President Frans Timmermans'],[],"('Antoine Colombani',)","('Cabinet member',)",06/15/22,"('79019799690-13',)",KfW Bankengruppe,Brussels,european green deal
10570,['Cabinet of Executive Vice-President Frans Timmermans'],[],"('Antoine Colombani',)","('Cabinet member',)",06/16/22,"('43763731235-75',)",Mouvement des Entreprises de France,Brussels,european green deal
10571,['Cabinet of Commissioner Didier Reynders'],[],"('Lucrezia Busa', 'Geneviève Tuts')","('Cabinet member', 'Cabinet member')",06/16/22,"('43763731235-75',)",Mouvement des Entreprises de France,Brussels,"proposal for a directive on corporate sustainability due diligence, proposals in the field of consumer policy and the sustainable consumption pledge."
10575,[],['Energy'],"('Ditte Juul Jørgensen',)","('Director-General',)",06/16/22,"('570335813082-79',)",Trans Adriatic Pipeline,"Brussels, Belgium",discussion with tap and socar about security of supply and related gas infrastructure.
10576,['Cabinet of Commissioner Olivér Várhelyi'],[],"('Szabolcs Horvath', 'Olivér Várhelyi')","('Cabinet member', 'Commissioner')",06/16/22,"('570335813082-79',)",Trans Adriatic Pipeline,BERL,southern gas corridor
10580,['Cabinet of Executive Vice-President Frans Timmermans'],[],"('Diederik Samsom', 'Stefanie Hiesinger')","('Cabinet member', 'Cabinet member')",06/16/22,"('75365248559-90',)",Carbon Market Watch,videoconference,exchange on recent developments in relation to the eu ets
10581,['Cabinet of Executive Vice-President Frans Timmermans'],[],"('Diederik Samsom', 'Stefanie Hiesinger')","('Cabinet member', 'Cabinet member')",06/16/22,"('75365248559-90',)",Carbon Market Watch,Brussels,exchange on recent developments in relation to the eu exchange on recent developments in relation to the eu ets
10586,['Cabinet of Commissioner Thierry Breton'],[],"('Joan Canton', 'Lucia Caudet', 'Thierry Breton')","('Cabinet member', 'Cabinet member', 'Commissioner')",06/16/22,"('95574664768-90',)",Verband der Automobilindustrie,"Brussels, Belgium","green and digital transition of the automotive industry, raw materials availability"
10587,['Cabinet of Commissioner Johannes Hahn'],[],"('Johannes Hahn',)","('Commissioner',)",06/16/22,"('95574664768-90',)",Verband der Automobilindustrie,Brussels,"green transition, strategic autonomy, supply chain disruptions, ets"
10588,['Cabinet of Commissioner Mairead Mcguinness'],[],"('Peter Power', 'Darta Tentere')","('Cabinet member', 'Cabinet member')",06/16/22,"('95574664768-90',)",Verband der Automobilindustrie,"Brussels, Belgium",sanctions
10615,"['Cabinet of Commissioner Paolo Gentiloni', 'Cabinet of Commissioner Paolo Gentiloni']",[],"('Marco Piantini', 'Paolo Gentiloni')","('Cabinet member', 'Commissioner')",06/21/22,"('1954267427-31',)",FERROVIE DELLO STATO ITALIANE S.p.A.,Brussels,"meeting with luigi ferraris, ceo of ferrovie dello stato italiane to discuss the implementation of the it rrp and on projects related to mobility and infrastructures"
10616,['Cabinet of Commissioner Adina Vălean'],[],"('Adina-Ioana Vălean',)","('Commissioner',)",06/21/22,"('1954267427-31',)",FERROVIE DELLO STATO ITALIANE S.p.A.,Brussels ,transport
10618,[],"['Internal Market, Industry, Entrepreneurship and SMEs']","('Kerstin Jorna',)","('Director-General',)",06/21/22,"('22400601191-42',)",Deutsche Industrie- und Handelskammer,Brussels,"*	resilience of value chains / strategic autonomy 
*	directive on corporate sustainability due diligence
*	eu innovation agenda
*	current and planned ipcei"
10619,['Cabinet of Commissioner Kadri Simson'],[],"('Tatiana Marquez Uriarte',)","('Cabinet member',)",06/21/22,"('22400601191-42',)",Deutsche Industrie- und Handelskammer,Brussels,overview of the repowereu initiative
10625,['Cabinet of President Ursula von der Leyen'],[],"('Valeria Miceli',)","('Cabinet member',)",06/21/22,"('46643241096-93',)",International Swaps and Derivatives Association,Brussels,"1.pre and post-trade transparency in mifir review. importance of level playing field. 
2.emir review: pension schemes, public entities, supervision, active accounts, role of esma.
3.basel proposal: market risk and level playing field."
10626,[],"['Financial Stability, Financial Services and Capital Markets Union']","('John Berrigan',)","('Director-General',)",06/21/22,"('46643241096-93',)",International Swaps and Derivatives Association,Brussels,"basel package, crr/crd and mifir"
10662,[],['Environment'],"('Florika Fink-Hooijer',)","('Director-General',)",06/23/22,"('010822218390-62',)",The Kraft Heinz Company,Brussels ,"circular economy package, water conservation, energy use and greenhouse gas emissions"
10663,[],['Agriculture and Rural Development'],"('Wolfgang Burtscher ',)","('Director-General',)",06/23/22,"('010822218390-62',)",The Kraft Heinz Company,Brussels,exchange of views about sustainable agriculture and food security
10672,['Cabinet of Executive Vice-President Frans Timmermans'],[],"('Lukas Visek', 'Helena Braun', 'Stefanie Hiesinger')","('Cabinet member', 'Cabinet member', 'Cabinet member')",06/23/22,"('40538475090-82',)",Fern,Brussels,carbon removal certification
10673,['Cabinet of Executive Vice-President Frans Timmermans'],[],"('Stefanie Hiesinger', 'Helena Braun', 'Lukas Visek')","('Cabinet member', 'Cabinet member', 'Cabinet member')",06/23/22,"('40538475090-82',)",Fern,Brussels,discussion on the commission's work on stimulating sustainable carbon cycles
10702,['Cabinet of Commissioner Janez Lenarčič'],[],"('Jasna Pajnkihar', 'Janez Lenarčič')","('Cabinet member', 'Commissioner')",06/27/22,"('64689102746-48',)",World Vision Brussels & EU Representation ivzw/aisbl,Brussels,"child protection, including children in armed conflict, education in emergencies, food insecurity, climate change, the crisis response in syria and afghanistan."
10703,['Cabinet of Vice-President Dubravka Šuica'],[],"('Colin Scicluna', 'Iris Abraham ')","('Cabinet member', 'Cabinet member')",06/27/22,"('64689102746-48',)",World Vision Brussels & EU Representation ivzw/aisbl,Brussels,"the implementation of the eu strategy on the rights of the child. 
the youth action plan and the implementation of meaningful child participation frameworks outside of the eu. 
child sexual abuse and guaranteeing children's safety online."
10705,['Cabinet of Executive Vice-President Frans Timmermans'],[],"('Diederik Samsom',)","('Cabinet member',)",06/27/22,"('726924727096-27',)",MBO Raad,Brussels,european green deal
10706,[],"['Employment, Social Affairs and Inclusion']","('Joost Korte',)","('Director-General',)",06/27/22,"('726924727096-27',)",MBO Raad,Brussels,green and digital transition
10707,['Cabinet of Executive Vice-President Margrethe Vestager'],[],"('Marta Balossino', 'Michele Piergiovanni')","('Cabinet member', 'Cabinet member')",06/27/22,"('7459401905-60',)",Intel Corporation,Brussels,issues within competition portfolio.
10708,[],"['Communications Networks, Content and Technology']","('Roberto Viola',)","('Director-General',)",06/27/22,"('7459401905-60',)",Intel Corporation,virtual + Brussels,semiconductor randd
10718,['Cabinet of President Ursula von der Leyen'],[],"('Anthony Whelan',)","('Cabinet member',)",06/28/22,"('070028236358-54',)",ASML Netherlands B.V.,Brussels,discussion conc. promote (eu chips act) and protect topics (sanctions and export controls)
10719,['Cabinet of Commissioner Thierry Breton'],[],"('Fabrice Comptour', 'Thierry Breton')","('Cabinet member', 'Commissioner')",06/28/22,"('070028236358-54',)",ASML Netherlands B.V.,Brussels,semiconductors
10734,['Cabinet of Vice-President Dubravka Šuica'],[],"('Iris Abraham ',)","('Cabinet member',)",06/28/22,"('711785245699-83',)",Discord Inc.,Brussels,"-discord's business model, work on child safety, and efforts in content moderation
-eu strategy for a bik
-the new law on the fight against online child sexual abuse material"
10735,['Cabinet of Commissioner Thierry Breton'],[],"('Filomena Chirico', 'Maurits-Jan Prinz')","('Cabinet member', 'Cabinet member')",06/28/22,"('711785245699-83',)",Discord Inc.,Brussels,presentation of the company's approach to content moderation and child protection
10752,['Cabinet of Commissioner Stella Kyriakides'],[],"('Stella Kyriakides',)","('Commissioner',)",06/29/22,"('38526121292-88',)",European Federation of Pharmaceutical Industries and Associations,Brussels,exchange of views on the upcoming pharmaceutical legislation
10753,['Cabinet of Vice-President Margaritis Schinas'],[],"('Margaritis Schinas', 'Maria Luisa Llano Cardenal')","('Vice-President', 'Cabinet member')",06/29/22,"('38526121292-88',)",European Federation of Pharmaceutical Industries and Associations,Brussels,pharma strategy
10801,['Cabinet of Executive Vice-President Margrethe Vestager'],[],"('Werner Stengg',)","('Cabinet member',)",07/01/22,"('708754041138-77',)","Zoom Video Communications, Inc.",Brussels,eu digital policy.
10802,['Cabinet of Commissioner Ylva Johansson'],[],"('Monika Maglione',)","('Cabinet member',)",07/01/22,"('708754041138-77',)","Zoom Video Communications, Inc.",VTC,eu efforts to prevent and tackle child sexual abuse
10813,['Cabinet of Commissioner Mairead Mcguinness'],[],"('Florian Denis',)","('Cabinet member',)",07/05/22,"('34369111614-57',)",Société Générale,Brussels,"banking package
cmdi
retail investor strategy
digital euro"
10814,[],"['Financial Stability, Financial Services and Capital Markets Union']","('John Berrigan',)","('Director-General',)",07/05/22,"('34369111614-57',)",Société Générale,Brussels,crr3/crd6
10815,['Cabinet of Executive Vice-President Valdis Dombrovskis'],[],"('Michael Hager', 'Andrea Beltramello')","('Cabinet member', 'Cabinet member')",07/05/22,"('34369111614-57',)",Société Générale,Brussels,financial services
10817,['Cabinet of Executive Vice-President Valdis Dombrovskis'],[],"('Zaneta Vegnere',)","('Cabinet member',)",07/05/22,"('3978240953-79',)",BUSINESSEUROPE,"BXL, Berlaymont","eu's bilateral trade agenda, trade and technology council, eu-us"
10818,['Cabinet of Executive Vice-President Valdis Dombrovskis'],[],"('Cristina Rueda Catry',)","('Cabinet member',)",07/05/22,"('3978240953-79',)",BUSINESSEUROPE,Brussels Belgium,"state of play of the trade and investment negotiations between the eu and india, mercosur and chile"
10849,['Cabinet of President Ursula von der Leyen'],[],"('Valeria Miceli',)","('Cabinet member',)",07/07/22,"('550494915045-08',)",London Stock Exchange Group,Brussels - virtual ,"clearing business in the eu: competitiveness of eu ccps, dto equivalence, eu supervision."
10850,['Cabinet of Commissioner Mairead Mcguinness'],[],"('Florian Denis',)","('Cabinet member',)",07/07/22,"('550494915045-08',)",London Stock Exchange Group,virtual ,"dto
ccps"
10855,['Cabinet of Commissioner Jutta Urpilainen'],[],"('Renaud Savignat',)","('Cabinet member',)",07/07/22,"('928308827208-10',)",Médecins Sans Frontières International,Videoconference,access to covid tools and global health issues
10856,['Cabinet of Commissioner Thierry Breton'],[],"('Maurits-Jan Prinz',)","('Cabinet member',)",07/07/22,"('928308827208-10',)",Médecins Sans Frontières International,Berlaymont,task force on vaccine production and initiatives in africa
10871,[],"['Internal Market, Industry, Entrepreneurship and SMEs']","('Kerstin Jorna',)","('Director-General',)",07/11/22,"('46302264606-44',)",Schneider Electric,Brussels,present their whitepaper on repowereu
10872,['Cabinet of Commissioner Adina Vălean'],[],"('Filip Alexandru Negreanu Arboreanu',)","('Cabinet member',)",07/11/22,"('46302264606-44',)",Schneider Electric,Brussels ,repowereu - empowering energy consumers for a more sustainable and resilient europe
10886,['Cabinet of Executive Vice-President Frans Timmermans'],[],"('Damyana Stoynova',)","('Cabinet member',)",07/12/22,"('006687715492-92',)",Rabobank,Brussels,discussed the broad thematic priorities for the cop and in particular climate adaptation and food security
10887,['Cabinet of Commissioner Stella Kyriakides'],[],"('Annukka Ojala',)","('Cabinet member',)",07/12/22,"('006687715492-92',)",Rabobank,Brussels,sustainable food systems
10894,['Cabinet of Vice-President Maroš Šefčovič'],[],"('Sofia Asteriadi', 'Grave Martijn De')","('Cabinet member', 'Cabinet member')",07/12/22,"('3978240953-79',)",BUSINESSEUROPE,Bruxelles,eu/uk and eu/ch
10895,['Cabinet of Commissioner Kadri Simson'],[],"('Tatiana Marquez Uriarte',)","('Cabinet member',)",07/12/22,"('3978240953-79',)",BUSINESSEUROPE,Online,preparedness winter package
10897,['Cabinet of Commissioner Mairead Mcguinness'],[],"('Darta Tentere',)","('Cabinet member',)",07/12/22,"('46302264606-44',)",Schneider Electric,"Brussels, Belgium",sustainable finance - taxonomy
10898,['Cabinet of Vice-President Věra Jourová'],[],"('Renate Nikolay',)","('Cabinet member',)",07/12/22,"('46302264606-44',)",Schneider Electric,Brussels,"taxonomy, green deal"
10925,[],"['Internal Market, Industry, Entrepreneurship and SMEs']","('Kerstin Jorna',)","('Director-General',)",07/13/22,"('6504541970-40',)",Volkswagen Aktiengesellschaft,Digital,dr steg would like to discuss present situation and his view on industry policy eu
10926,['Cabinet of Executive Vice-President Frans Timmermans'],[],"('Daniel Mes',)","('Cabinet member',)",07/13/22,"('6504541970-40',)",Volkswagen Aktiengesellschaft,video conference ,green transition in automotive
11061,['Cabinet of Commissioner Thierry Breton'],[],"('Thierry Breton', 'Fabrice Comptour')","('Commissioner', 'Cabinet member')",09/05/22,"('070028236358-54',)",ASML Netherlands B.V.,Brussels,semiconductors
11062,['Cabinet of Commissioner Thierry Breton'],[],"('Maurits-Jan Prinz',)","('Cabinet member',)",09/05/22,"('070028236358-54',)",ASML Netherlands B.V.,eindhoven,technological sovereignty and eu chips act
11069,['Cabinet of Executive Vice-President Valdis Dombrovskis'],[],"('Andrea Beltramello', 'Zaneta Vegnere')","('Cabinet member', 'Cabinet member')",09/05/22,"('56362448807-46',)",Human Rights Watch,BERL,"due diligence, forced labour"
11070,['Cabinet of Executive Vice-President Margrethe Vestager'],[],"('Alejandro Cainzos',)","('Cabinet member',)",09/05/22,"('56362448807-46',)",Human Rights Watch,Brussels,eu policies.
11071,['Cabinet of Executive Vice-President Margrethe Vestager'],[],"('Alejandro Cainzos', 'Christiane Canenbley')","('Cabinet member', 'Cabinet member')",09/05/22,"('56362448807-46',)",Human Rights Watch,Brussels,relations with china.
11084,['Cabinet of Executive Vice-President Frans Timmermans'],[],"('Frans Timmermans',)","('Executive Vice-President',)",09/06/22,"('3394026642-58',)",BP p.l.c.,Brussels,"global gas markets, investments in green hydrogen and repowereu objectives with respect to diversification of gas supply, energy savings and renewable energy acceleration"
11085,['Cabinet of Commissioner Mairead Mcguinness'],[],"('Darta Tentere', 'Mairead McGuinness')","('Cabinet member', 'Commissioner')",09/06/22,"('3394026642-58',)",BP p.l.c.,"Brussels, Belgium",sustainable finance
11088,['Cabinet of Vice-President Věra Jourová'],[],"('Simona Constantin',)","('Cabinet member',)",09/06/22,"('383658039791-39',)",Schwarz Corporate Affairs International GmbH,Brussels,"rule of law and the impact on the european single market,  due diligence and corporate responsibility in (global) supply chains, data protection / privacy shield"
11089,['Cabinet of Commissioner Virginijus Sinkevičius'],[],"('Rozalina Petrova', 'Virginijus Sinkevičius')","('Cabinet member', 'Commissioner')",09/06/22,"('383658039791-39',)",Schwarz Corporate Affairs International GmbH,Berlaymont,"to exchange views on the progress towards a more circular economy, including on the forthcoming initiative under the circular economy action plan on packaging and packaging waste."
11104,['Cabinet of President Ursula von der Leyen'],[],"('Kurt Vandenberghe',)","('Cabinet member',)",09/07/22,"('05032108616-26',)",Shell Companies,Brussels (VC),price cap russian oil
11105,['Cabinet of Commissioner Kadri Simson'],[],"('Stefano Grassi',)","('Cabinet member',)",09/07/22,"('05032108616-26',)",Shell Companies,Videconference,winter preparedness (discussion together with cabinet von der leyen)
11111,['Cabinet of Commissioner Thierry Breton'],[],"('Filomena Chirico', 'Thierry Breton')","('Cabinet member', 'Commissioner')",09/07/22,"('365747616583-15',)",Spotify,Brussels,compliance with dsa and dma
11112,['Cabinet of Vice-President Věra Jourová'],[],"('Věra Jourová',)","('Vice-President',)",09/07/22,"('365747616583-15',)",Spotify,Brussels,digital services act and emfa
11113,['Cabinet of Executive Vice-President Margrethe Vestager'],[],"('Margrethe Vestager', 'Michele Piergiovanni')","('Executive Vice-President', 'Cabinet member')",09/07/22,"('365747616583-15',)",Spotify,Brussels,issues within competition portfolio.
11131,['Cabinet of Executive Vice-President Valdis Dombrovskis'],[],"('Valdis Dombrovskis ',)","('Executive Vice-President',)",09/08/22,"('011095511691-05',)",Society for Worldwide Interbank Financial Telecommunication,Prague,application of sanctions to russia
11132,['Cabinet of Commissioner Mairead Mcguinness'],[],"('Paul Moley', 'Tommy De Temmerman', 'Mairead McGuinness')","('Cabinet member', 'Cabinet member', 'Commissioner')",09/08/22,"('011095511691-05',)",Society for Worldwide Interbank Financial Telecommunication,Prague,instant payments and sanctions
11146,['Cabinet of Executive Vice-President Margrethe Vestager'],[],"('Alejandro Cainzos',)","('Cabinet member',)",09/08/22,"('72029513877-54',)",ACT | The App Association,Brussels,digital policies.
11147,['Cabinet of Executive Vice-President Margrethe Vestager'],[],"('Alejandro Cainzos', 'Alina-Stefania Ujupan')","('Cabinet member', 'Cabinet member')",09/08/22,"('72029513877-54',)",ACT | The App Association,Brussels,"regulation for mobile phones, cordless phones and tablets"
11155,['Cabinet of Executive Vice-President Margrethe Vestager'],[],"('Alejandro Cainzos',)","('Cabinet member',)",09/09/22,"('281155638075-51',)",OVH Groupe,online,digital policies.
11156,['Cabinet of Executive Vice-President Margrethe Vestager'],[],"('Alina-Stefania Ujupan', 'Alejandro Cainzos')","('Cabinet member', 'Cabinet member')",09/09/22,"('281155638075-51',)",OVH Groupe,online,european cybersecurity certification scheme for cloud services
11189,['Cabinet of Commissioner Helena Dalli'],[],"('Silvan Agius',)","('Cabinet member',)",09/13/22,"('85083981189-35',)",Platform of European Social NGOs,Brussels,meeting to discuss eu solidarity strategy to respond to the ukraine crisis.
11190,[],"['Employment, Social Affairs and Inclusion']","('Joost Korte',)","('Director-General',)",09/13/22,"('85083981189-35',)",Platform of European Social NGOs,Brussels,social dialogue
11229,[],['Energy'],"('Ditte Juul Jørgensen',)","('Director-General',)",09/16/22,"('6256831207-27',)",ENEL SpA,"Brussels, Belgium","emergency interventions in the electricity and gas markets, solar power supply chains."
11230,['Cabinet of Commissioner Kadri Simson'],[],"('Stefano Grassi',)","('Cabinet member',)",09/16/22,"('6256831207-27',)",ENEL SpA,Brussels,pv supply chain - winter outlook for electricity and gas markets
11257,['Cabinet of Executive Vice-President Frans Timmermans'],[],"('Helena Braun',)","('Cabinet member',)",09/20/22,"('054662633848-40',)",Wildlife Conservation Society European Union office,Brussels,"implementation of biodiversity policies, including preparation of biodiversity cop15 and cites cop19"
11258,['Cabinet of Commissioner Stella Kyriakides'],[],"('Ines Prainsack', 'Annukka Ojala')","('Cabinet member', 'Cabinet member')",09/20/22,"('054662633848-40',)",Wildlife Conservation Society European Union office,Brussels,one health and pandemic agreement
11261,['Cabinet of Executive Vice-President Valdis Dombrovskis'],[],"('Cristina Rueda Catry',)","('Cabinet member',)",09/20/22,"('21851435137-02',)",Ford Motor Company,Brussels,"fta eu - mexico
 electric vehicles"
11262,['Cabinet of Executive Vice-President Frans Timmermans'],[],"('Daniel Mes',)","('Cabinet member',)",09/20/22,"('21851435137-02',)",Ford Motor Company,Brussels,transition to electric mobility
11267,['Cabinet of Vice-President Margaritis Schinas'],[],"('Margaritis Schinas', 'Maria Luisa Llano Cardenal')","('Vice-President', 'Cabinet member')",09/20/22,"('52431421-12',)","Telefonica, S.A.",Brussels,cybersecurity
11268,['Cabinet of Commissioner Thierry Breton'],[],"('Thierry Breton', 'Filomena Chirico')","('Commissioner', 'Cabinet member')",09/20/22,"('52431421-12',)","Telefonica, S.A.",Brussels,the future of connectivity infrastructure
11299,['Cabinet of President Ursula von der Leyen'],[],"('Valeria Miceli',)","('Cabinet member',)",09/21/22,"('78787381113-69', '4722660838-23')","BNP PARIBAS,European Banking Federation",Brussels,bnp paribas views on potential price caps and liquidity measures in the context of the energy crisis
11300,['Cabinet of Commissioner Mairead Mcguinness'],[],"('Florian Denis', 'Katherine Power')","('Cabinet member', 'Cabinet member')",09/21/22,"('78787381113-69', '4722660838-23')","BNP PARIBAS,European Banking Federation","Brussels, Belgium",energy market liquidity measures
11322,['Cabinet of Executive Vice-President Frans Timmermans'],[],"('Helena Braun',)","('Cabinet member',)",09/22/22,"('64879142323-90',)",European Chemical Industry Council,Brussels,"implementation of the eu chemicals strategy for sustainability, in particular the revisions of clp and reach"
11323,['Cabinet of Commissioner Janusz Wojciechowski'],[],"('Jorge Pinto Antunes',)","('Cabinet member',)",09/22/22,"('64879142323-90',)",European Chemical Industry Council,Brussels,"ongoing revision of the classification, labelling and packaging (clp) regulation to share key considerations from the european chemical industry, ahead of the next regulatory steps"
11330,['Cabinet of Executive Vice-President Frans Timmermans'],[],"('Daniel Mes',)","('Cabinet member',)",09/22/22,"('97914681026-14',)",Société nationale SNCF,video-call,rail freight policy.
11331,['Cabinet of Commissioner Adina Vălean'],[],"('Elzbieta Lukaniuk',)","('Cabinet member',)",09/22/22,"('97914681026-14',)",Société nationale SNCF,Online meeting,rail freight policy..
11351,['Cabinet of Commissioner Thierry Breton'],[],"('Thierry Breton',)","('Commissioner',)",09/26/22,"('774019931221-41',)",Inter Ikea Systems BV,"Brussels, Belgium","circularity, sustainable use of forests, single market for secondary materials"
11352,['Cabinet of Executive Vice-President Frans Timmermans'],[],"('Helena Braun',)","('Cabinet member',)",09/26/22,"('774019931221-41',)",Inter Ikea Systems BV,Brussels,"implementation of the european green deal, in particular circular economy, biodiversity and forest policies"
11359,['Cabinet of Commissioner Helena Dalli'],[],"('Helena Dalli',)","('Commissioner',)",09/27/22,"('1095068839-59',)",Ingka Services A.B.,Brussels ,commissioner dalli met with ingka (ikea) group ceo jesper brodin to discuss commission initiatives on inclusion and diversity as well as to exchange views on how inclusion and diversity are leading values that foster economic development.
